{
  "$schema": "https://json-schema.org/draft/2020-12/schema",
  "$id": "poses.schema.json",
  "title": "Poses y gestos por hueso (mundo/datos/poses.json)",
  "description": "Poses fijas y gestos de las personas de cajas, por canal (nombres cortos de .claude/skills/animaciones-minecraft/referencia/rig.md). Un canal vale: número fijo, o claves k interpoladas (o base) más osciladores. Equivale a las funciones de GESTOS (escenas-skin.js) y GESTOS_AMISTAD (escena-amistad-datos.js): ruta() es k con interp suave y Math.sin(t * f) es un oscilador. Lo que no se pueda expresar así (condiciones, composición como alHombro) sigue en JS; si un gesto no está aquí, el juego usa el del código. Lo lee mundo/datos/gestos.js (fase 6): un gesto reemplaza por nombre al del código; los nuevos y las poses fijas se suman a GESTOS.",
  "type": "object",
  "properties": {
    "$schema": { "type": "string" },
    "version": { "$ref": "comun.schema.json#/$defs/version" },
    "nota": { "$ref": "comun.schema.json#/$defs/nota" },
    "limites": {
      "description": "Límites duros de cada canal en radianes ([mín, máx]): aplicarAngulos (supervivencia/pose-jugador.js) recorta a este rango, así ninguna animación ni la CPU deja un codo al revés o una rodilla hacia adelante (bloque 8 · N1, mundo/COMBATE.md §15.5). Canales nuevos: codoD codoI (− adelante y arriba), rodD rodI (+ la canilla atrás), pX pY pZ (el pecho sobre las caderas), pDz pIz (abrir la pierna hacia afuera), bDy bIy (giro del brazo), ry (giro del cuerpo), armaX armaZ (muñeca virtual del arma). Lo que falte o esté mal usa el valor del código.",
      "type": "object",
      "propertyNames": { "enum": ["cx", "cy", "cz", "bDx", "bIx", "bDz", "bIz", "bDy", "bIy", "pDx", "pIx", "inc", "ry", "rz", "codoD", "codoI", "rodD", "rodI", "pX", "pY", "pZ", "pDz", "pIz", "armaX", "armaZ"] },
      "additionalProperties": {
        "type": "array",
        "prefixItems": [{ "$ref": "comun.schema.json#/$defs/radianes" }, { "$ref": "comun.schema.json#/$defs/radianes" }],
        "minItems": 2,
        "maxItems": 2
      }
    },
    "poses": {
      "description": "Poses fijas (atlas de rig.md): nombre -> canales numéricos.",
      "type": "object",
      "propertyNames": { "$ref": "comun.schema.json#/$defs/clave" },
      "additionalProperties": {
        "type": "object",
        "properties": {
          "canales": { "$ref": "#/$defs/canalesFijos" },
          "nota": { "$ref": "comun.schema.json#/$defs/nota" }
        },
        "required": ["canales"],
        "additionalProperties": false
      }
    },
    "gestos": {
      "description": "Gestos animados: nombre (el mismo que usan las pistas de las escenas) -> definición.",
      "type": "object",
      "propertyNames": { "$ref": "comun.schema.json#/$defs/clave" },
      "additionalProperties": { "$ref": "#/$defs/gesto" }
    }
  },
  "required": ["version"],
  "additionalProperties": false,
  "$defs": {
    "nombreCanal": {
      "description": "cx cy cz: cuello · bDx bDz bIx bIz: brazos · pDx pIx: piernas · inc rz y: cuerpo · salto: se suma a y (el motor lo apaga sentado) · pz: avanza el cuerpo (abrazos) · bDy bIy: brazo gira sobre su eje · ry: cuerpo gira · codoD codoI: codos · rodD rodI: rodillas · pX pY pZ: pecho sobre las caderas · pDz pIz: pierna abre afuera · armaX armaZ: muñeca virtual del arma (rig con codos, rodillas y pecho; COMBATE.md §15.5).",
      "enum": ["cx", "cy", "cz", "bDx", "bDz", "bIx", "bIz", "pDx", "pIx", "inc", "rz", "y", "salto", "pz", "bDy", "bIy", "ry", "codoD", "codoI", "rodD", "rodI", "pX", "pY", "pZ", "pDz", "pIz", "armaX", "armaZ"]
    },
    "canalesFijos": {
      "type": "object",
      "propertyNames": { "$ref": "#/$defs/nombreCanal" },
      "additionalProperties": { "$ref": "comun.schema.json#/$defs/radianes" }
    },
    "canales": {
      "type": "object",
      "propertyNames": { "$ref": "#/$defs/nombreCanal" },
      "additionalProperties": { "$ref": "#/$defs/canal" }
    },
    "canal": {
      "anyOf": [
        { "$ref": "comun.schema.json#/$defs/radianes" },
        {
          "type": "object",
          "properties": {
            "base": { "description": "Valor de partida si no hay k (por defecto 0).", "type": "number" },
            "k": {
              "description": "Claves [tiempo, valor] en orden creciente de tiempo, en el reloj del gesto. Antes de la primera y después de la última se mantiene el valor del extremo (como ruta()). Una clave puede traer un 3.er elemento (suave | lineal | paso) que manda en el tramo que empieza en ella (DISENO §40, decisión 21: subida suave y bajada lineal).",
              "type": "array",
              "minItems": 1,
              "items": { "type": "array", "prefixItems": [{ "type": "number" }, { "type": "number" }, { "enum": ["suave", "lineal", "paso"] }], "minItems": 2, "maxItems": 3 }
            },
            "interp": { "description": "suave (smoothstep, como ruta(); por defecto), lineal o paso.", "enum": ["suave", "lineal", "paso"] },
            "osc": { "type": "array", "items": { "$ref": "#/$defs/oscilador" } },
            "nota": { "$ref": "comun.schema.json#/$defs/nota" }
          },
          "additionalProperties": false
        }
      ]
    },
    "oscilador": {
      "description": "Se suma: amp * forma(t * frec + fase) * envolvente. t es siempre el reloj de la escena en segundos (igual que en el código).",
      "type": "object",
      "properties": {
        "forma": { "description": "sin = Math.sin · abs = |sin| · pos = max(0, sin) · neg = min(0, sin).", "enum": ["sin", "abs", "pos", "neg"] },
        "amp": { "type": "number" },
        "frec": { "description": "Multiplica a t (rad/s), como Math.sin(t * frec).", "type": "number" },
        "fase": { "type": "number" },
        "en": {
          "description": "Con qué avanza la onda (DISENO §40, decisión 14): t = segundos de la escena (por defecto), u = 0..1 dentro del tramo (sin(π·u) sube y baja una vez), o { k, interp } = claves [x, avance] en el reloj del gesto (la onda avanza con esa curva).",
          "anyOf": [
            { "enum": ["t", "u"] },
            {
              "type": "object",
              "properties": {
                "k": { "type": "array", "minItems": 1, "items": { "type": "array", "prefixItems": [{ "type": "number" }, { "type": "number" }], "minItems": 2, "maxItems": 2 } },
                "interp": { "enum": ["suave", "lineal", "paso"] }
              },
              "required": ["k"],
              "additionalProperties": false
            }
          ]
        },
        "pot": { "description": "Potencia con su signo (abs con pot 3 = |sen|³: un cabeceo seco).", "type": "number", "minimum": 0.1, "maximum": 8 },
        "env": {
          "description": "[a, b]: multiplica por tramo(u, a, b), con u = 0..1 dentro del tramo del gesto (sube de 0 a 1 entre a y b).",
          "type": "array", "prefixItems": [{ "type": "number" }, { "type": "number" }], "minItems": 2, "maxItems": 2
        }
      },
      "required": ["forma", "amp", "frec"],
      "additionalProperties": false
    },
    "gesto": {
      "type": "object",
      "properties": {
        "reloj": {
          "description": "En qué tiempo están las claves k: t = reloj de la escena en s (como GESTOS_AMISTAD hoy) · local = s desde que empieza el tramo del gesto (necesita la duración del tramo; los motores de hoy no la pasan y el juego usa t: mejor u o t) · u = 0..1 dentro del tramo.",
          "enum": ["t", "local", "u"]
        },
        "ciclo": { "description": "Si está, el reloj de k se repite cada ciclo segundos (hachazo, martillo).", "type": "number", "minimum": 0.05 },
        "canales": { "$ref": "#/$defs/canales" },
        "extiende": {
          "description": "Parte de otro gesto (DISENO §40, decisión 13): primero corre «gesto» (MOLDES, GESTOS_AMISTAD, GESTOS o poses.json) con su reloj corrido (t − reloj) y en espejo si se pide; «por» multiplica canales de la base; después los canales propios reemplazan o agregan.",
          "type": "object",
          "properties": {
            "gesto": { "$ref": "comun.schema.json#/$defs/clave" },
            "reloj": { "type": "number" },
            "espejo": { "type": "boolean" },
            "por": { "$ref": "#/$defs/canales" }
          },
          "required": ["gesto"],
          "additionalProperties": false
        },
        "apoya": { "description": "Pies apoyados solos (decisión 15): con el cuerpo inclinado (inc), piernas rectas (pDx = pIx = −inc) y la cadera baja lo justo (y). Manda sobre esos tres canales.", "type": "boolean" },
        "variantes": {
          "description": "Canales que reemplazan a los de arriba en un caso: sentado (el actor está sentado) o jugador (el cuerpo del jugador, p. ej. en espejo).",
          "type": "object",
          "properties": {
            "sentado": { "$ref": "#/$defs/canales" },
            "jugador": { "$ref": "#/$defs/canales" }
          },
          "additionalProperties": false
        },
        "nota": { "$ref": "comun.schema.json#/$defs/nota" }
      },
      "required": ["reloj", "canales"],
      "additionalProperties": false
    }
  }
}
