{
  "$schema": "../../estudio/esquemas/poses.schema.json",
  "version": 1,
  "limites": {
    "cx": [-1, 1],
    "cy": [-1.6, 1.6],
    "cz": [-0.6, 0.6],
    "bDx": [-3, 1],
    "bIx": [-3, 1],
    "bDz": [-0.8, 1.6],
    "bIz": [-1.6, 0.8],
    "bDy": [-1.2, 1.2],
    "bIy": [-1.2, 1.2],
    "pDx": [-1.8, 1.2],
    "pIx": [-1.8, 1.2],
    "inc": [-0.6, 1.6],
    "ry": [-1.2, 1.2],
    "rz": [-0.6, 0.6],
    "codoD": [-2.6, 0],
    "codoI": [-2.6, 0],
    "rodD": [0, 2.4],
    "rodI": [0, 2.4],
    "pX": [-0.35, 0.9],
    "pY": [-0.9, 0.9],
    "pZ": [-0.3, 0.3],
    "pDz": [-0.15, 0.5],
    "pIz": [-0.15, 0.5],
    "armaX": [-1.6, 1.6],
    "armaZ": [-1.6, 1.6]
  },
  "poses": {
    "neutral": {
      "canales": { "bDz": 0.05, "bIz": -0.05 },
      "nota": "rig.md"
    },
    "brazoHorizontal": {
      "canales": { "bDx": -1.57 },
      "nota": "rig.md: mano a 1.5 de alto, 0.75 adelante"
    },
    "doblarse": {
      "canales": { "inc": 0.6, "pDx": -0.6, "pIx": -0.6, "y": 0.13, "bDx": -0.55, "bDz": 0.12, "bIx": 0.25, "cx": 0.3 },
      "nota": "rig.md: doblarse de cintura y bajar la mano"
    },
    "inclinadoPecho": {
      "canales": { "inc": 0.3, "pDx": -0.3, "pIx": -0.3, "y": 0.034, "bDx": -1.6 },
      "nota": "rig.md: mano a la altura del pecho"
    },
    "sentadoSuelo": {
      "canales": { "y": -0.62, "pDx": -1.45, "pIx": -1.45, "inc": 0.15, "bDx": -1, "bDz": 0.1, "cx": 0.35 },
      "nota": "rig.md"
    },
    "sentadoSilla": {
      "canales": { "pDx": -1.5, "pIx": -1.5 },
      "nota": "rig.md: el actor va 0.6 más alto"
    }
  },
  "gestos": {
    "asiente": {
      "reloj": "t",
      "canales": {
        "cx": {
          "base": 0.08,
          "osc": [
            { "forma": "pos", "amp": 0.3, "frec": 7 }
          ]
        }
      },
      "nota": "escenas-skin.js GESTOS.asiente"
    },
    "habla": {
      "reloj": "t",
      "canales": {
        "bDx": {
          "base": -0.9,
          "osc": [
            { "forma": "sin", "amp": 0.3, "frec": 5 }
          ]
        },
        "bDz": {
          "base": 0.2,
          "osc": [
            { "forma": "sin", "amp": 0.15, "frec": 3.1 }
          ]
        },
        "bIx": {
          "base": -0.55,
          "osc": [
            { "forma": "sin", "amp": 0.2, "frec": 4, "fase": 1 }
          ]
        },
        "bIz": -0.15,
        "cx": {
          "osc": [
            { "forma": "sin", "amp": 0.06, "frec": 6 }
          ]
        }
      },
      "nota": "escenas-skin.js GESTOS.habla"
    },
    "rasca": {
      "reloj": "t",
      "canales": {
        "bDx": {
          "base": -2.85,
          "osc": [
            { "forma": "sin", "amp": 0.08, "frec": 14 }
          ]
        },
        "bDz": 0.42,
        "bIx": -0.15,
        "bIz": -0.05,
        "cx": 0.12,
        "cz": 0.15
      },
      "nota": "escenas-skin.js GESTOS.rasca"
    },
    "yo": {
      "reloj": "t",
      "canales": {
        "bDx": -1.25,
        "bDz": {
          "base": 0.85,
          "osc": [
            { "forma": "sin", "amp": 0.06, "frec": 10 }
          ]
        },
        "bIx": -0.1,
        "cx": 0.3
      },
      "nota": "escenas-skin.js GESTOS.yo"
    },
    "tu": {
      "reloj": "t",
      "canales": {
        "bDx": -1.6,
        "bDz": {
          "base": 0.05,
          "osc": [
            { "forma": "sin", "amp": 0.03, "frec": 6 }
          ]
        },
        "bIx": -0.15,
        "cx": -0.05
      },
      "nota": "escenas-skin.js GESTOS.tu"
    },
    "mano": {
      "reloj": "t",
      "canales": {
        "bDx": {
          "base": -1.45,
          "osc": [
            {
              "forma": "sin",
              "amp": 0.08,
              "frec": 9,
              "env": [0.3, 0.5]
            }
          ]
        },
        "bDz": 0.15
      },
      "nota": "escenas-skin.js GESTOS.mano"
    },
    "saluda": {
      "reloj": "t",
      "canales": {
        "bDx": -2.7,
        "bDz": {
          "base": -0.35,
          "osc": [
            { "forma": "sin", "amp": 0.35, "frec": 9 }
          ]
        }
      },
      "nota": "escenas-skin.js GESTOS.saluda"
    },
    "risa": {
      "reloj": "t",
      "canales": {
        "bDx": -0.55,
        "bDz": 0.35,
        "bIx": -0.55,
        "bIz": -0.35,
        "cx": -0.35,
        "salto": {
          "osc": [
            { "forma": "abs", "amp": 0.05, "frec": 17 }
          ]
        }
      },
      "nota": "escenas-skin.js GESTOS.risa"
    },
    "pasa": {
      "reloj": "t",
      "canales": { "bDx": -1.35, "bDz": 0.1, "cx": 0.1 },
      "nota": "escenas-skin.js GESTOS.pasa"
    },
    "dedo": {
      "reloj": "t",
      "canales": { "bIx": -1.45, "bIz": -0.35, "cx": 0.4, "cy": 0.35 },
      "nota": "escenas-skin.js GESTOS.dedo"
    },
    "puno": {
      "reloj": "t",
      "canales": {
        "bDx": {
          "k": [[0.45, 0], [1.45, -0.98], [1.8, -0.78], [2, -0.93], [2.2, -0.3], [2.4, -0.05]],
          "interp": "suave"
        },
        "bDz": {
          "k": [[0.45, 0.05], [1.45, 0.45], [1.8, 0.4], [2, 0.45], [2.2, -0.5], [2.4, -0.2]],
          "interp": "suave"
        },
        "cx": 0.1
      },
      "nota": "escena-amistad-datos.js GESTOS_AMISTAD.puno (keyframes en tiempo de escena, golpe en t = 1.45)"
    },
    "acomodarSombrero": {
      "reloj": "u",
      "canales": {
        "bDx": {
          "k": [[0, 0], [0.12, 0.08], [0.38, -2.55], [0.5, -2.62], [0.6, -2.48], [0.7, -2.58], [0.88, -1.2], [1, 0]],
          "interp": "suave"
        },
        "bDz": {
          "k": [[0, 0], [0.38, 0.45], [0.7, 0.45], [1, 0]],
          "interp": "suave"
        },
        "cx": {
          "k": [[0, 0], [0.4, 0], [0.52, 0.28], [0.7, 0.2], [1, 0]],
          "interp": "suave"
        },
        "cy": {
          "k": [[0, 0], [0.42, 0], [0.55, 0.18], [0.8, 0.1], [1, 0]],
          "interp": "suave"
        },
        "inc": {
          "k": [[0, 0], [0.5, 0.05], [1, 0]],
          "interp": "suave"
        }
      },
      "nota": "Bloque 8 · L1 (reto del duelo): Lalo lleva la mano derecha al ala del sombrero (bDx -2.6 / bDz 0.45, como el gesto «sombrero» de momentos/moises.js), lo baja con un tirón corto y gira la cabeza un poco. Reloj u (0 a 1 dentro del tramo); pensado para ~1.6 s."
    },
    "tronarDedos": {
      "reloj": "u",
      "canales": {
        "bDx": {
          "k": [[0, 0], [0.14, -0.9], [0.3, -1.2], [0.4, -1.1], [0.47, -1.6], [0.6, -1.6], [0.72, -0.5], [0.82, 0]],
          "interp": "suave"
        },
        "bIx": {
          "k": [[0, 0], [0.14, -0.9], [0.3, -1.2], [0.4, -1.1], [0.47, -1.6], [0.6, -1.6], [0.72, -0.5], [0.82, 0]],
          "interp": "suave"
        },
        "bDz": {
          "k": [[0, 0], [0.3, 0.5], [0.4, 0.5], [0.47, 0.42], [0.6, 0.42], [0.72, 0.1], [0.82, 0]],
          "interp": "suave"
        },
        "bIz": {
          "k": [[0, 0], [0.3, -0.5], [0.4, -0.5], [0.47, -0.42], [0.6, -0.42], [0.72, -0.1], [0.82, 0]],
          "interp": "suave"
        },
        "inc": {
          "k": [[0, 0], [0.4, -0.05], [0.47, 0.14], [0.62, 0.1], [0.8, 0]],
          "interp": "suave"
        },
        "cx": {
          "k": [[0, 0], [0.47, 0.12], [0.65, 0.05], [0.78, 0.22], [0.9, 0.08], [1, 0]],
          "interp": "suave"
        },
        "cy": {
          "k": [[0, 0], [0.62, 0], [0.76, 0.7], [0.92, 0.6], [1, 0]],
          "interp": "suave"
        },
        "cz": {
          "k": [[0, 0], [0.62, 0], [0.72, -0.28], [0.86, 0.22], [1, 0]],
          "interp": "suave"
        }
      },
      "nota": "Bloque 8 · L1 (reto del duelo): Moisés junta las manos al pecho (bDz 0.5 / bIz -0.5), las estira al frente con un tirón (los hombros acompañan con inc) y rueda el cuello a un lado. Reloj u; pensado para ~1.8 s."
    }
  }
}
